-- pgaudix regression tests
-- Setup
CREATE EXTENSION pgaudix;
-- ============================================================
-- Test 1: Enable auditing
-- ============================================================
CREATE TABLE public.test_orders (
    id      serial PRIMARY KEY,
    amount  numeric(10,2),
    status  text
);
SELECT pgaudix.enable('public.test_orders');
 enable 
--------
 
(1 row)

-- Verify audit table exists
SELECT column_name, data_type
FROM information_schema.columns
WHERE table_schema = 'public' AND table_name = 'test_orders_audit'
ORDER BY ordinal_position;
    column_name    |        data_type         
-------------------+--------------------------
 audit_id          | bigint
 audit_operation   | character
 audit_timestamp   | timestamp with time zone
 audit_txid        | bigint
 audit_user        | name
 audit_client_addr | inet
 audit_app_name    | text
 id                | integer
 amount            | numeric
 status            | text
(10 rows)

-- Verify registration
SELECT source_schema, source_table, audit_table, enabled
FROM pgaudix.status();
 source_schema | source_table |    audit_table    | enabled 
---------------+--------------+-------------------+---------
 public        | test_orders  | test_orders_audit | t
(1 row)

-- ============================================================
-- Test 2: INSERT audit
-- ============================================================
INSERT INTO public.test_orders (amount, status) VALUES (100.50, 'pending');
SELECT audit_operation, audit_user, id, amount, status
FROM public.test_orders_audit
ORDER BY audit_id;
 audit_operation | audit_user | id | amount | status  
-----------------+------------+----+--------+---------
 I               | postgres   |  1 | 100.50 | pending
(1 row)

-- ============================================================
-- Test 3: UPDATE audit (single row with new values)
-- ============================================================
UPDATE public.test_orders SET status = 'shipped', amount = 105.00 WHERE id = 1;
SELECT audit_operation, id, amount, status
FROM public.test_orders_audit
ORDER BY audit_id;
 audit_operation | id | amount | status  
-----------------+----+--------+---------
 I               |  1 | 100.50 | pending
 U               |  1 | 105.00 | shipped
(2 rows)

-- ============================================================
-- Test 4: DELETE audit
-- ============================================================
DELETE FROM public.test_orders WHERE id = 1;
SELECT audit_operation, id, amount, status
FROM public.test_orders_audit
ORDER BY audit_id;
 audit_operation | id | amount | status  
-----------------+----+--------+---------
 I               |  1 | 100.50 | pending
 U               |  1 | 105.00 | shipped
 D               |  1 | 105.00 | shipped
(3 rows)

-- ============================================================
-- Test 5: DDL sync - ADD COLUMN
-- ============================================================
ALTER TABLE public.test_orders ADD COLUMN notes text;
-- Verify the audit table also has the new column
SELECT column_name, data_type
FROM information_schema.columns
WHERE table_schema = 'public' AND table_name = 'test_orders_audit'
  AND column_name = 'notes';
 column_name | data_type 
-------------+-----------
 notes       | text
(1 row)

-- Test that new column is audited
INSERT INTO public.test_orders (amount, status, notes) VALUES (200.00, 'new', 'test note');
SELECT audit_operation, amount, status, notes
FROM public.test_orders_audit
WHERE audit_id = (SELECT max(audit_id) FROM public.test_orders_audit);
 audit_operation | amount | status |   notes   
-----------------+--------+--------+-----------
 I               | 200.00 | new    | test note
(1 row)

-- ============================================================
-- Test 6: DDL sync - RENAME COLUMN
-- ============================================================
ALTER TABLE public.test_orders RENAME COLUMN notes TO description;
SELECT column_name
FROM information_schema.columns
WHERE table_schema = 'public' AND table_name = 'test_orders_audit'
  AND column_name = 'description';
 column_name 
-------------
 description
(1 row)

-- ============================================================
-- Test 7: DDL sync - ALTER COLUMN TYPE
-- ============================================================
ALTER TABLE public.test_orders ALTER COLUMN amount TYPE numeric(12,4);
SELECT column_name, numeric_precision, numeric_scale
FROM information_schema.columns
WHERE table_schema = 'public' AND table_name = 'test_orders_audit'
  AND column_name = 'amount';
 column_name | numeric_precision | numeric_scale 
-------------+-------------------+---------------
 amount      |                12 |             4
(1 row)

-- ============================================================
-- Test 8: DDL sync - DROP COLUMN
-- ============================================================
ALTER TABLE public.test_orders DROP COLUMN description;
SELECT column_name
FROM information_schema.columns
WHERE table_schema = 'public' AND table_name = 'test_orders_audit'
  AND column_name = 'description';
 column_name 
-------------
(0 rows)

-- ============================================================
-- Test 9: Disable auditing (keep data)
-- ============================================================
SELECT pgaudix.disable('public.test_orders');
 disable 
---------
 
(1 row)

-- DML trigger should be gone
SELECT count(*) FROM pg_trigger
WHERE tgname = 'pgaudix_audit_trigger'
  AND tgrelid = 'public.test_orders'::regclass;
 count 
-------
     0
(1 row)

-- TRUNCATE trigger should be gone
SELECT count(*) FROM pg_trigger
WHERE tgname = 'pgaudix_truncate_trigger'
  AND tgrelid = 'public.test_orders'::regclass;
 count 
-------
     0
(1 row)

-- Audit table should still exist
SELECT count(*) FROM information_schema.tables
WHERE table_schema = 'public' AND table_name = 'test_orders_audit';
 count 
-------
     1
(1 row)

-- ============================================================
-- Test 10: Disable with drop_data
-- ============================================================
DROP TABLE IF EXISTS public.test_orders_audit;
SELECT pgaudix.enable('public.test_orders');
 enable 
--------
 
(1 row)

SELECT pgaudix.disable('public.test_orders', drop_data := true);
 disable 
---------
 
(1 row)

-- Audit table should be gone
SELECT count(*) FROM information_schema.tables
WHERE table_schema = 'public' AND table_name = 'test_orders_audit';
 count 
-------
     0
(1 row)

-- ============================================================
-- Test 11: SECURITY DEFINER search_path (H1)
-- ============================================================
SELECT proname, proconfig
FROM pg_proc p
JOIN pg_namespace n ON p.pronamespace = n.oid
WHERE n.nspname = 'pgaudix'
  AND p.proname IN ('enable', 'disable', 'ddl_sync', 'truncate_trigger', 'audit_trigger')
  AND proconfig::text LIKE '%search_path%'
ORDER BY proname;
     proname      |              proconfig              
------------------+-------------------------------------
 audit_trigger    | {"search_path=pgaudix, pg_catalog"}
 ddl_sync         | {"search_path=pgaudix, pg_catalog"}
 disable          | {"search_path=pgaudix, pg_catalog"}
 enable           | {"search_path=pgaudix, pg_catalog"}
 truncate_trigger | {"search_path=pgaudix, pg_catalog"}
(5 rows)

-- ============================================================
-- Test 12: Duplicate enable() is rejected (H3)
-- ============================================================
SELECT pgaudix.enable('public.test_orders');
 enable 
--------
 
(1 row)

-- Try enabling again — should fail
DO $$
BEGIN
    PERFORM pgaudix.enable('public.test_orders');
    RAISE NOTICE 'ERROR: duplicate enable should have failed';
EXCEPTION WHEN OTHERS THEN
    RAISE NOTICE 'OK: duplicate enable rejected: %', SQLERRM;
END;
$$;
NOTICE:  OK: duplicate enable rejected: pgaudix: table public.test_orders is already monitored
-- ============================================================
-- Test 13: TRUNCATE audit (M1)
-- ============================================================
INSERT INTO public.test_orders (amount, status) VALUES (300.00, 'active');
INSERT INTO public.test_orders (amount, status) VALUES (400.00, 'active');
TRUNCATE public.test_orders;
-- Should have I, I, and T rows
SELECT audit_operation, id, amount, status
FROM public.test_orders_audit
ORDER BY audit_id;
 audit_operation | id |  amount  | status 
-----------------+----+----------+--------
 I               |  3 | 300.0000 | active
 I               |  4 | 400.0000 | active
 T               |    |          | 
(3 rows)

-- ============================================================
-- Test 14: Audit table permissions (M2)
-- ============================================================
-- Create a test role
CREATE ROLE pgaudix_test_user LOGIN;
GRANT USAGE ON SCHEMA public TO pgaudix_test_user;
GRANT ALL ON public.test_orders TO pgaudix_test_user;
GRANT USAGE ON SEQUENCE public.test_orders_id_seq TO pgaudix_test_user;
GRANT SELECT ON public.test_orders_audit TO pgaudix_test_user;
-- Test that direct INSERT to audit table is denied
SET ROLE pgaudix_test_user;
DO $$
BEGIN
    EXECUTE 'INSERT INTO public.test_orders_audit (audit_operation) VALUES (''X'')';
    RAISE NOTICE 'ERROR: direct audit INSERT should have been denied';
EXCEPTION WHEN insufficient_privilege THEN
    RAISE NOTICE 'OK: direct audit INSERT denied';
END;
$$;
NOTICE:  OK: direct audit INSERT denied
-- Test that DML on source table still works (trigger has SECURITY DEFINER)
INSERT INTO public.test_orders (amount, status) VALUES (500.00, 'test');
RESET ROLE;
-- Verify the audit row was created by the trigger (audit_user = session_user)
SELECT audit_operation, audit_user = session_user AS correct_user, amount, status
FROM public.test_orders_audit
WHERE audit_id = (SELECT max(audit_id) FROM public.test_orders_audit);
 audit_operation | correct_user |  amount  | status 
-----------------+--------------+----------+--------
 I               | t            | 500.0000 | test
(1 row)

-- Cleanup test role
REVOKE ALL ON public.test_orders FROM pgaudix_test_user;
REVOKE ALL ON SEQUENCE public.test_orders_id_seq FROM pgaudix_test_user;
REVOKE ALL ON public.test_orders_audit FROM pgaudix_test_user;
REVOKE USAGE ON SCHEMA public FROM pgaudix_test_user;
DROP ROLE pgaudix_test_user;
-- ============================================================
-- Test 15: RENAME TABLE keeps auditing working (H2)
-- ============================================================
-- Clear audit data for clean test
TRUNCATE public.test_orders_audit;
ALTER TABLE public.test_orders RENAME TO test_orders_renamed;
NOTICE:  pgaudix: updated registration for renamed table public.test_orders_renamed (audit table unchanged: public.test_orders_audit)
-- Verify registration was updated
SELECT source_table, audit_table
FROM pgaudix.status();
    source_table     |    audit_table    
---------------------+-------------------
 test_orders_renamed | test_orders_audit
(1 row)

-- DML on renamed table should still be audited
INSERT INTO public.test_orders_renamed (amount, status) VALUES (600.00, 'renamed');
SELECT audit_operation, amount, status
FROM public.test_orders_audit
WHERE audit_id = (SELECT max(audit_id) FROM public.test_orders_audit);
 audit_operation |  amount  | status  
-----------------+----------+---------
 I               | 600.0000 | renamed
(1 row)

-- DDL sync should still work after rename
ALTER TABLE public.test_orders_renamed ADD COLUMN extra text;
SELECT column_name
FROM information_schema.columns
WHERE table_schema = 'public' AND table_name = 'test_orders_audit'
  AND column_name = 'extra';
 column_name 
-------------
 extra
(1 row)

-- Rename back for cleanup
ALTER TABLE public.test_orders_renamed RENAME TO test_orders;
NOTICE:  pgaudix: updated registration for renamed table public.test_orders (audit table unchanged: public.test_orders_audit)
ALTER TABLE public.test_orders DROP COLUMN extra;
-- ============================================================
-- Test 16: SPI error handling - audit failure aborts DML (C1)
-- ============================================================
-- Force an audit column mismatch by dropping a column from audit table directly
-- (Disable DDL sync guard temporarily)
SELECT pgaudix.disable('public.test_orders', drop_data := true);
 disable 
---------
 
(1 row)

SELECT pgaudix.enable('public.test_orders');
 enable 
--------
 
(1 row)

TRUNCATE public.test_orders_audit;
-- Drop a column from audit table to cause a mismatch
-- The ddl_sync will fire and warn, but the DROP proceeds
ALTER TABLE public.test_orders_audit DROP COLUMN status;
WARNING:  pgaudix: direct ALTER on audit table is not recommended — changes may be overwritten by DDL sync
-- Now INSERT should fail because the trigger tries to write to a missing column
DO $$
BEGIN
    INSERT INTO public.test_orders (amount, status) VALUES (999.99, 'should_fail');
    RAISE NOTICE 'ERROR: INSERT should have failed due to audit column mismatch';
EXCEPTION WHEN OTHERS THEN
    RAISE NOTICE 'OK: INSERT aborted due to audit failure: %', SQLERRM;
END;
$$;
NOTICE:  OK: INSERT aborted due to audit failure: column "status" of relation "test_orders_audit" does not exist
-- Verify no row was inserted into the source table
SELECT count(*) FROM public.test_orders WHERE amount = 999.99;
 count 
-------
     0
(1 row)

-- ============================================================
-- Cleanup
-- ============================================================
SELECT pgaudix.disable('public.test_orders', drop_data := true);
 disable 
---------
 
(1 row)

DROP TABLE public.test_orders;
DROP EXTENSION pgaudix;
